{
  "name": "RS485 NH3 (암모니아) 가스 센서",
  "vendor": "Generic",
  "model": "NH3-RS485-01",
  "description": "전기화학식 NH3 가스 센서. Winsen ME3-NH3 또는 Renke NH3 transmitter의 RS485 변환 모듈. 0-100 ppm.",
  "protocol": "modbus_rtu",
  "interface_type": "rs485",
  "default_polling_interval_sec": 10,
  "connection": {
    "baudrate": 9600,
    "parity": "N",
    "data_bits": 8,
    "stop_bits": 1
  },
  "measurements": [
    {
      "key": "ammonia",
      "display_name": "암모니아 NH3",
      "unit": "ppm",
      "data_type": "float",
      "modbus": { "function_code": 3, "register": 0, "length": 1 },
      "scale": 0.1, "min": 0, "max": 100,
      "visualization": "gauge",
      "display_group": "hazardous_gas",
      "order": 1
    }
  ]
}
